Date,ID,WeightedAVG,Title,TitleNegative,TitleNeutral,TitlePositive,TitleCompound,Text,TextNegative,TextNeutral,TextPositive,TextCompound,Upvotes,Downvotes
2022-05-05 11:02:31,uiuye5,0.5729,Morpher (MPH) which is run on the ETH blockchain is launching a project that will let you support Ukraine by trading virtual copies of Russian stocks.,0.0,0.899,0.101,0.4019,"I work at Morpher Labs and we’ve been putting virtual copies of stocks, and cryptos on the blockchain since 2018. Profits and losses are dependent on the price action of the market you are trading. On Morpher you can open positions on stocks, cryptos, indices, and commodities.   


Our protocol augments and overcomes the limitations of the underlying market. Morpher Protocol consists of a set of smart contracts and an oracle service. The smart contracts are responsible for processing trades, managing Virtual Futures, and setting MPH Token balances. Where the Oracle connects the Protocol to live market data.

Since we have a team composed of both Russians and Ukrainians, we decided to create this side project to both help Ukrainians and raise awareness of how Russians are suffering from sanctions.

Morpher Arena will use blockchain technology to let investors trade virtual copies of sanctioned Russian stocks. All profits generated by the platform will be donated to organizations supporting Ukrainian refugees.

Russian companies, shareholders, and oligarchs will not profit from the trading, because users won’t trade real Russian stocks, just virtual copies of them powered by the Morpher Protocol.   
At the same time, Morpher Arena will also allow Russian investors to bet against (short) Russian stocks, something they currently cannot do on the Moscow Stock Exchange.

Here is the link if you want to learn more about it: [www.traderussianstocks.com](http://www.traderussianstocks.com/) 

Please feel free to give us some feedback on the idea. We would love to know what you think.",0.03,0.843,0.127,0.9719,1,0
2022-05-04 20:16:10,uifis6,0.6281,"Ethereum price to reverse the trend... While a move to $3,500 is likely, a surge in buying pressure could extend the run-up to the $4,000 psychological level. I'll continue to stack, stake and HODL ETH to the richest!!! GLTA!!!",0.052,0.801,0.148,0.6209,"Ethereum price to reverse the trend 

Ethereum price is in a medium-term ascending channel created by connecting its two higher highs and three higher lows since January 28. 

The third retest of the lower trend line has shown a bullish reaction – lead cryptocurrency  BTC is recovering and influencing the rest of the market. Regardless of the bullishness, ETH needs to flip the 100-day SMA at $2,914 followed by the 50-day SMA at $3,069 to continue rising. This development is key to triggering a move that tags the 200-day SMA at $3,443.

While a move to $3,500 is likely, a surge in buying pressure could extend the run-up to the $4,000 psychological level.

On the other hand, a daily candlestick close below the weekly support level at $2,541 will indicate a resurgence of selling pressure and invalidate the bullish thesis. This could trigger a further crash to the $2,000 psychological level.

By: Akash Girimath, FXStreet

&#x200B;

[We just got a huge surge in all risk-assets. ETH up +6.67&#37; today after the Fed announced a 50 basis point increase in the Federal Funds rate. I'm currently long-term 139.085+ ETH, 135 ETH staked and HODL to year 2028!!! GLTA!!! ](https://preview.redd.it/kfsgawx0oix81.jpg?width=1096&format=pjpg&auto=webp&s=2c3f5df09997cf19910e635f49665177b4d61c38)",0.055,0.869,0.076,0.6449,23,0
2022-05-04 19:25:20,uiee8q,0.46416999999999997,you're welcome,0.0,0.25,0.75,0.4588,I sold a solid chunk of my portfolio last night. You can thank me for this pump.,0.0,0.76,0.24,0.4767,1,0
2022-05-04 18:18:15,uicy05,0.52816,ETH/USD Forecast: Ethereum Gives Up Early Gains,0.0,0.714,0.286,0.34,"As we continue to hover around the $2800 level, the Ethereum market tried to rally but gave back early gains. The previous candlestick was a hammer, and the fact that we're attempting to construct a shooting star indicates that the market is bouncing around in this area and attempting to form a very short-term consolidation range.

We will eventually break out of this short-term range and select the next course of action, but I believe we will need to see an impulsive candlestick to tell us which way to move at this time. Ethereum has many utilities including as a fuel to NFT projects like Little Esther, Plastiks which is backed by recycling data, Hydrominer which is about hydroelectricity, Cycled, Decentraland e.t.c and so it is a bound to enjoy a rise sooner rather than later. If we move to the upside, the $3000 level would be the first objective, which also happens to be the 50-day EMA. The enormous, round, psychologically significant figure will draw some attention regardless, and then there's the 200-day EMA on top of that.

On the other hand, a break below the hammer for Monday's session opens the door to a move down to the $2750 level, and subsequently to the $2500 level. Because the $2500 level has already seen a lot of support, I believe it will only be a matter of time before purchasers try to support Ethereum in that approximate neighborhood. A break below $2500 might unleash a new wave of selling pressure, which would most likely follow Bitcoin and other crypto markets. 

I believe we will see a lot of choppy activity at the very least, so I would be cautious about my position size, but as the market begins to move in the direction of a larger rally or breakdown, we can begin to put more money to work. In the end, I believe that the Ethereum market will continue to suffer alongside Bitcoin, but I do believe that we will see some support. The question now is whether we'll be able to achieve it here or if we'll have to dig deeper to locate it.",0.026,0.885,0.089,0.9672,35,0
2022-05-04 16:59:02,uib6mx,0.7239,ETH is holding up pretty well actually (compared to last year)...,0.0,0.629,0.371,0.6486,"For those who remember last year, ETH plummeted to below $1900 from $4k, just because of some Elon tweets.

Now, we have Russia war (even threats of nuclear), Fed rate hikes, so much more FUD, but ETH is holding up at $2800.

ETH has proven itself really in 2022, patience is needed, but surely ETH will reach a new ATH in the near future!

Most importantly, the fundamentals of ETH are constantly improving, thanks to the tireless efforts of ETH developers!",0.069,0.757,0.174,0.8996,1,0
2022-05-04 13:07:45,ui66s2,0.34171999999999997,Stuff that may help when you are hunting altcoins/NFTs,0.0,0.748,0.252,0.4019,"At these cryptos/tokens the market cap isnt everything but the total liquidity in exchangers.



If there is a 1bln market cap coin doesn't mean its a safe buy, it can mean theorically that only 1 tx has been done and then the market cap is defined only by that, for this reason always focus on volume, liquidity and circulating supply.

And about nfts, think about it as a marketplace with low/russian roulette liquidity, buying NFTs is as risky as buying coins with low liquidity, meaning that you can easily buy, but not sell.


Wish you all luck out there in the DeFi world!",0.098,0.811,0.091,0.2013,4,0
2022-05-04 12:42:56,ui5p5r,0.60464,"Ethereum price prediction: $5,800 by the end of 2022 — more than double its current level of $2,800. Stack, Stake and HODL ETH to the richest!!! GLTA!!!",0.0,0.846,0.154,0.6776,"Ethereum, the second-largest cryptocurrency after bitcoin, has seen its price swing wildly over the last year—hampered recently by a searing attack from Twitter cofounder Jack Dorsey.

The ethereum price has lost around 43% since its peak of almost $5,000 per ether set late last year. Meanwhile, smart contract rivals BNB BNB +1.4%, solana, cardano, avalanche and polkadot have seen similar volatility.

Now, a panel of 36 industry experts has returned an ethereum price prediction of almost $5,800 by the end of 2022—more than double its current level of $2,800.

By Billy Bambrough, Forbes

&#x200B;

[To date, I've earned 3.9 ETH from staking!!! I'm projected to earn 3.2 more ETH by the end of this year, taking my total ETH earned to 7.1 ETH!!! Just keep on stacking via staking and HODL to the richest!!! GLTA!!!](https://preview.redd.it/31ikx6ilfgx81.jpg?width=1089&format=pjpg&auto=webp&s=24d4c4d9c4e1513e5c6708f6cdf69600d355a376)",0.038,0.911,0.051,0.4344,0,0
2022-05-04 11:44:50,ui4nl1,0.51623,"Did you know that over the next four years, the blockchain market is predicted to increase by 68.4 percent?",0.0,0.887,0.113,0.3182,"Over the next four years, the blockchain market is predicted to increase by 68.4 percent, with 86% of senior executives expecting blockchain will become a widely used technology.  


That is something I frequently think about, especially when I learn about some great ideas that function on a blockchain or are made possible by the blockchain.  


I was intrigued with how blockchain can secure our data, which has been a huge concern in recent years due to the prevalence of hacking.  


I was fascinated by Modex, which creates scalable products and services that employ blockchain technology to change the way data and digital assets are stored, exchanged, and managed, might be one of the solutions to this dilemma for huge organizations.  


However, blockchain technology continues to be a rapidly expanding area of growth for businesses in a variety of industries.  


Would you agree that blockchain technology has the potential to far outperform cryptocurrencies in terms of the total effect and that the true potential of blockchain is only now being realized?  


I am certain that the full potential of blockchain technology has yet to be realized.",0.009,0.827,0.164,0.9783,12,0
2022-05-04 10:57:48,ui3wl9,-0.024039999999999895,"What do you think is the next big thing? Just remember that ETH and BTC were unworthy at first, and look where they are today",0.111,0.889,0.0,-0.4588,"Bitcoin is now seen as digital gold by many speculators, but it may also be used as a digital form of payment. While Bitcoin may be thought of as digital gold, Ethereum is constructing a worldwide computing platform that will support many other cryptocurrencies as well as a vast ecosystem of decentralized apps.  


These two are among the finest investments anyone can make, but what about the next projects? Remember that ETH and BTC were unworthy at first, and look where they are today. So sometimes being patient really works out.   


I was completely stunned (in a positive way) to learn that I may use Unicoins to invest in corporations with great expansion potential and that the earnings earned by such investments will be distributed to all Unicoin holders on a regular basis as dividends. This initiative appears to be promising (no more pump and dump difficulties or scams!).  


We'd all like to discover a long-term investment and be delighted with the results, but the fact is that it's difficult to anticipate which of all these initiatives and currencies will be the best option. Especially now, when there are so many of these projects to choose from.  


Experienced traders have been speculating on cryptocurrencies, but what if you're new to the industry and want to get in on the ground floor? So I'm asking for your opinions, and I wish you the best of success in your search for the next thing that will erupt as BTC did.",0.055,0.769,0.176,0.9904,13,0
2022-05-04 10:15:59,ui3av2,-0.8179099999999999,"Do you believe that the statement ""The NFT market is collapsing"" was intended to cause panic, or that it was the result of poor judgment and harmless misinformation?",0.304,0.641,0.056,-0.836,"Would you say that ‘the NFT market is collapsing’ cause the data says otherwise and I would say that people started panicking without any valid reason?  


That doesn't seem reasonable, given that the top five collections alone accounted for more than $1 billion in primary and secondary sales in the same week they said the market was collapsing, don't you think?  


I found out that in that article they stated that data from the NFT market analysis platform Nonfungible suggests the number of NFT sales has fallen by 92% since an all-time high in September 2021. Wallets active in the Ethereum NFT market were also said to have declined by 88% since a high in November 2021. I was like whaaaat???   


Why would anyone say something like that?   


What about the Moonbirds collection, what about all these upcoming collections and NFT projects? I followed all this news about them and I personally looking forward to some of them, Sk8coin for example, and maybe a few more.  


Do you think that this attempt to create a panic is intentional or just someone's bad judgment and harmless misinformation?",0.099,0.826,0.075,-0.7757,9,0
2022-05-04 09:48:00,ui2x04,0.72603,"Do you feel secure with some of this blockchain protection that keeps your data, files, and privacy safe?",0.0,0.751,0.249,0.6486,"Since I've seen how these data protection platforms become popular and people are feeling safe with them, I decided to start some digging for more information on this topic.   


Do you use some of this blockchain protection to keep your data, files, and privacy safe?  


Every internet user should be able to select not just how their data and digital identity are utilized, but also which data they choose to keep private or public, and under what terms.  


With the rise of technology has come the rise of projects and platforms that offer data protection. For example, having Zenotta's blockchain that re-imagines digital ownership and grounds it in a legal framework is cool, it was about time that we had platforms like this that provide us with saving our data (whether it's a photo, video, or anything else).  


I think that's really great to know that we can now have all of that on a blockchain because, as data manipulation and theft become more common, these data sovereignty initiatives are becoming increasingly important for all of us who use the internet.  


How do you cope with these issues, and does this concern you?   


Unfortunately, I had a chance to experience some of these issues, and I don't think I'd want to go through them again, they were very unpleasant.",0.05,0.838,0.111,0.9067,10,0
2022-05-04 07:52:04,ui1fie,0.02565000000000006,"Do you believe Ethereum's scalability concerns have opened the way for ""ETH killers"" to seize the opportunity?",0.195,0.679,0.127,-0.3612,"The problem is that even though how much Ethereum is powerful and powerful, all these coins that people call ""Ethereum killers"" are made to resolve all these Ethereum issues.   


We're often dealing with the low scalability, network congestion, high gas fees, and environmental concerns which are some of the major issues. Some of these issues I control with Metis and before Metis other similar L2 solutions as I believe you all do as well.   


Ofc that the technology behind the Ethereum blockchain is the primary reason for its meteoric rise, but as we are all aware there are these issues that must be solved. I really hope that transition PoS is going to be soon launched.  


What do you think about ""Ethereum killers""?   


They are very certainly attempting to dethrone Ethereum by fixing its blockchain flaws like as low scalability, expensive fees, low tps, and environmental concerns. They propose to do so by adopting the proof-of-scale consensus technique. Among the most well-known are Cardano, Solana, Polkadot, and Tezos.  


Do you think they have any chance? And what do you think will happen with them as soon as the Ethereum merge happens?",0.054,0.818,0.128,0.9283,8,0
2022-05-03 23:48:46,uhtfdl,0.7684899999999999,OC Comedy Post Contest Winners,0.0,0.349,0.651,0.6808,"In the first place the winner is the user u/XpensiveLove

Post: https://www.reddit.com/r/ethtrader/comments/udr1qk/insert_titleor_ethereum/?utm_source=share&utm_medium=web2x&context=3

Prize: 1000 donuts


In second place we have a tie between the users u/ReitHodlr and u/JETTTZOR

Posts: https://www.reddit.com/r/ethtrader/comments/uh5tf6/congrats_boys_and_girls_i_think_we_can_only_go_up/?utm_medium=android_app&utm_source=share

https://www.reddit.com/r/ethtrader/comments/ud860h/im_holding_until_im_dead/?utm_source=share&utm_medium=web2x&context=3

Prize: 400 donuts


And in third place the winner is the user u/Silverni

Post: https://www.reddit.com/r/ethtrader/comments/udgolb/cheers_to_my_fellow_eth_degens/?utm_source=share&utm_medium=web2x&context=3

Prize: 100 donuts

Congratulations to the winners...

Keep participating in the weekly contest.",0.0,0.699,0.301,0.9731,3,0
2022-05-03 19:01:30,uhn8um,-0.11084000000000005,ETH has been teetering in and out of oversold territory for a month straight,0.0,0.863,0.137,0.2263,"The fear and greed index is getting less and less fearful over the course of a month and a half. 

Are these indicators to buy? 
When do you guys foresee the bottom coming in. Or are we there yet? 

Are these metrics useless?",0.243,0.757,0.0,-0.8975,3,0
2022-05-03 14:53:43,uhhvi5,0.80571,[Governance Poll] Switch Liquidity Incentive Bonuses for Honeyswap and Uniswap,0.0,0.567,0.433,0.7269,"The Goal of this Governance post is to swap the bonus incentives awarded to those who provide liquidity for the Donut-Dai pair and Donut-ETH pair on Honeyswap and Uniswap respectively.

As all new donuts will be distributed via the Gnosis(xdai) chain more and more liquidity will be getting added to the honeyswap pool thinning out the overall bonus for those providing liquidity on the chain that is already lower than the Uniswap bonus. Currently Uniswap LP providers who stake their donuts get 400k bonus donuts while honeyswap LP providers only get 200k bonus donuts. I would like to see these numbers swapped so honeyswap providers get 400k and uniswap providers get 200k. This would further incentivize people to use their newly acquired donuts to provide LP as all tokens are now distributed on gnosis and learn more about how defi works in the process.

**Poll: The poll can be found on Snapshot** [**https://snapshot.org/#/ethtraderdao.eth/proposal/0x6d8f183b5d6a70febe23058183524c35facaedc77543ba3a8bb985f13289f224**](https://snapshot.org/#/ethtraderdao.eth/proposal/0x6d8f183b5d6a70febe23058183524c35facaedc77543ba3a8bb985f13289f224)

 Should we swap the monthly Liquidity providing bonuses for Uniswap(400k) and Honeyswap(200k) donut LP providing

1.\[Yes\] Swap the Uniswap and Honeyswap LP providing bonus incentives

2. \[No\] Remain as is for LP bonus incentives

3. \[Abstain\] You are indifferent

**Poll proposal discussion** [https://www.reddit.com/r/ethtrader/comments/ufe0nn/poll\_proposal\_switch\_liquidity\_incentive\_bonuses/](https://www.reddit.com/r/ethtrader/comments/ufe0nn/poll_proposal_switch_liquidity_incentive_bonuses/)

For Transparency purposes I currently own 0.195% of the dai-Donut liquidity pool.

 **This governance poll will remain up for a minimum of 5 days per \[governance guidelines\](**[**https://www.reddit.com/r/ethtrader/wiki/governance**](https://www.reddit.com/r/ethtrader/wiki/governance)**). All votes should be cast on \[our snapshot.org site\](**[**https://snapshot.org/#/ethtraderdao.eth**](https://snapshot.org/#/ethtraderdao.eth)**) to be included** ",0.015,0.822,0.163,0.9896,22,0
2022-05-03 10:30:13,uhd35z,-0.004899999999999904,What would you say is the most difficult part when it comes to deciding what should you invest in next?,0.128,0.872,0.0,-0.4201,"I find myself sometimes pretty confused about what next should I invest in, so I've been curious to find out how you decide what's the best thing for you to invest in.  


Have you ever found yourself asking, ""Should I be investing in Ethereum?"" or ""Should I invest in meme coins?"" Or perhaps you've already invested in some and aren't sure what to do next? It occurred to me a few times, and these queries simply lead to further thought and confusion.  


The worst part is that we have is the fact that the crypto industry is constantly changing. Traders’ interests change, infrastructure changes, and a coin can be immensely popular one day and disappear the next.  


I'm currently interested so much in Unicoins which would be invested in companies with great expansion potential and the best of these companies may be featured on our Unicorn Hunters show. If you watch it then you'll know how cool that show is. I'm keeping an eye on these coins and I hope that I'll soon decide what should I do, but I must admit that I'm pretty interested so far.  


You all know that there are numerous options available and that might be challenging at times. Especially when numerous altcoins are aiming to achieve the same thing or have ideas so large that they will take decades to fully comprehend.  


How long does it take for you to decide in which crypto to invest, do you observe it for some time first or you're willing to take a risk without any previous research?",0.041,0.838,0.121,0.9639,11,0
2022-05-03 08:13:19,uhb9vc,0.4379200000000001,"Do you believe GameFi is introducing us to a new form of playing games, and that conventional video games will be phased out soon?",0.0,0.924,0.076,0.2023,"I've asked myself this a couple of times since there's a lot of buzz about GameFi and new methods of playing video games, people become fascinated with them, and I've seen kids using these VR headsets for playing games more and more, it's so different from playing games when I was a kid.  


Even some major video game developers and publishers are entering the NFT industry with NFT games or reintroducing games that we have been playing for decades as NFT games.  


I understand that everything evolves and changes with time, which is OK, but does this imply that we will soon lose the video games we have enjoyed for so long?  


What do you think about that, are you okay with having only NFT-powered/p2e games?  


I didn't say I didn't like these games, cause K4 Rally is my favorite, and the gameplay, rewards, tournaments, everything about it is fantastic and I truly like it, but that doesn't mean I'd like Dota 2, which I've been playing since I was a kid, to become an NFT-powered game, no way! So I understand why players are opposed to this notion, they are undoubtedly concerned that it would transform gaming from its roots.  


Do you think that's possible? Would you be okay with it?",0.027,0.777,0.196,0.9877,11,0
2022-05-02 20:28:35,ugyvmc,0.64293,"Banking Giant Standard Chartered Sees Ethereum Reaching $35,000. Do you agree or is it too much of a stretch?",0.0,0.788,0.212,0.5106,"According to Business Insider, Geoffrey Kendrick, head of crypto research at British banking behemoth Standard Chartered, believes that the price of Ethereum can still achieve $35,000 in the long run.
According to Kendrick, the forthcoming switch to proof-of-stake will undoubtedly benefit Ether's price. According to U.Today, following a series of delays, the much-anticipated network upgrade is set to take place later this year.

To capitalize on increased institutional demand for cryptocurrencies, one of Standard Chartered's businesses revealed plans to open a cryptocurrency brokerage in July.
Bill Winters, the CEO of Standard Chartered, stated in October that bitcoin was here to stay. Because central banks are experimenting with their monetary policy, he said it was ""absolutely reasonable"" for consumers to invest in non-fiat cryptocurrencies.

In my opinion I think it is possible for the crypto
giant to hit $35,000 in the long run.  Cryptocurrencies are gradually breaking into mainstream as we have seen it gradually breaking into government and banking institutions and with an increasing number of countries adopting it.
Cryptocurrencies and the blockchain community are steadily breaking grounds with new innovative projects such as Decentraland  an online world that allows users to create their own avatars and purchase plots of virtual land, Faith tribe which is a platform for creating trading, distribution, and monetization of designs of fashion, Luckyblock which  is a digital asset project that decentralizies the lottery process via blockchain technology feasible. With continuous innovation like this the government and institutions wouldn't be able to ignore cryptocurrencies utility.
 In the coming years I think they will cryptocurrencies would be part of the banking and governing infrastructure. When this eventually does occur $35,000 for Ether won't be a stretch.",0.014,0.903,0.083,0.9517,68,0
2022-05-02 17:14:21,ugukhv,0.09413000000000002,When do you think the next bull run will be? Serious question,0.106,0.894,0.0,-0.0772,Just to share opinions... We know that nobody can guarantee anything in the market,0.0,0.741,0.259,0.4939,0,0
2022-05-02 16:12:29,ugt5s2,0.43642000000000003,Please help me,0.0,0.167,0.833,0.6124,I am a stupid f***ing idiot.I accidentally sent eth from a rosten network to an erc-20 network on binance. Is ther any way that i recover it please please please tell me and thankyou,0.154,0.663,0.183,0.0258,0,0
