Date,ID,WeightedAVG,Title,TitleNegative,TitleNeutral,TitlePositive,TitleCompound,Text,TextNegative,TextNeutral,TextPositive,TextCompound,Upvotes,Downvotes
2022-05-07 16:53:07,ukhew3,0.009250000000000091,if Crypto is Risky remember life is also risky.,0.34,0.66,0.0,-0.3818,"Take out $125k for College, people congratulate you.

Take out $50k for a new car, people congratulate you.

Invest aggressively in Crypto to try to build a better future for yourself, people tell you it’s too risky.

Let them celebrate debt.
We’ll stay focused on wealth building.",0.107,0.586,0.306,0.9217,1,0
2022-05-07 11:46:12,ukblb2,0.7326,What do you find most amazing when it comes to blockchain tech?,0.0,0.729,0.271,0.624,"By the conclusion of the second half of 2022, there will be a stronger need for blockchain and crypto expertise. The increasing popularity of cryptocurrencies, the increasing popularity of blockchain across a wide range of enterprises, and the potential for development in the blockchain industry all contribute to increased demand for blockchain and crypto capabilities.  


It's incredible how rapidly the promise of blockchain for improving people's lives and building more resilient organizations is being fulfilled by huge corporations and governments, rather than just a small hyper-technical group of IT professionals.  


Companies seek blockchain experts to assist them in implementing blockchain technology to meet their objectives. After doing an additional study into the blockchain industry, I discovered a few amazing firms about which I wanted to learn more.  


What I've learned so far, Duet Protocol is one of these firms, they're a multi-chain asset platform that can be utilized to construct a blockchain asset. I'm excited to see how this project evolves in the future!  


What do you find most amazing when it comes to blockchain tech?",0.008,0.803,0.19,0.986,1,0
2022-05-07 09:20:57,uk9kup,-0.17059999999999997,This crash is just going to be a wipeout for shitcoins,0.231,0.769,0.0,-0.4019,"Hear me out

There are literally thousands of shitcoin and coins that pretend not be be shitcoins much of whom are large cap not to name (ada) these coins have no specific use and mosly identify as ""peer to peer cash"" or ""smart contracts platform""

These are the reasons for why some people think crypto is a scam as ther are hundreds of coins claiming the same utility (not saying it is necessarily a bad thing)

Then there are the high apy's for stablecoins. do you really think that banks could ever turn a  profit by providing its costomers 20% apy s when the profit they make is 4-6% this is juat not sustainable sure there are mechanisms put it place and actuall cash to make sure it doesn't implodes but it will eventually happen as they cannot just pump cash infinitely

Crypto is just like the dot com bubbles loads of scams and company's ending there names in dot com to boost their share price

There will be total wipe outs of some of the big names but there will be survives 

Just HODL as much as you can afford to lose and you could be rewarded big time",0.087,0.824,0.089,0.3691,5,0
2022-05-07 02:40:29,uk3po0,0.5832999999999999,"[Including Scan Result Link] Crypto/NFT Investment Portfolio Tracker Template for Excel | Cryptocurrencies, NFTs, and more | Live Data & Calculations",0.0,0.85,0.15,0.4588,"Hello,

This is a spreadsheet I made to easily keep track of my investments. I've decided to share it for free as a give back to the community.

&#x200B;

𝐅𝐞𝐚𝐭𝐮𝐫𝐞𝐬

\-------------

[https://www.youtube.com/watch?v=gIlkqdGDb8s](https://www.youtube.com/watch?v=gIlkqdGDb8s)

&#x200B;

𝐇𝐨𝐰 𝐢𝐭 𝐰𝐨𝐫𝐤𝐬 (𝐆𝐮𝐢𝐝𝐞 𝐢𝐧𝐜𝐥𝐮𝐝𝐞𝐝)

\-------------------------------------------

1. Portfolio’s Currency is selected.
2. History is inputted either with a CSV file or manually (Transactions, Trades, Dividends).
3. Each investment’s information is specified (Asset Class, Region, Sector, etc.)
4. All data are then calculated automatically based on the above information.

&#x200B;

https://preview.redd.it/ha67lyhm1zx81.jpg?width=2700&format=pjpg&auto=webp&s=47b7ea9cdc370c2b1a6f3181eafaa5c26755ac27

https://preview.redd.it/j474s6im1zx81.jpg?width=2700&format=pjpg&auto=webp&s=5031f93f109d48f7d918002c593377536b11adce

https://preview.redd.it/kxkck1im1zx81.jpg?width=2700&format=pjpg&auto=webp&s=5fc2b5a22021151bd0a9e0a832ea8f310f860a26

https://preview.redd.it/qvlersim1zx81.jpg?width=2700&format=pjpg&auto=webp&s=4971e29c643ec05f531137e608e05b04297b205b

https://preview.redd.it/2a2rmkim1zx81.jpg?width=2700&format=pjpg&auto=webp&s=b7c832a536957d003c6841de8d7c56fe4a147d9b

𝟏𝟕 𝐓𝐚𝐛𝐬/𝐒𝐡𝐞𝐞𝐭𝐬

\----------------------

(w/Automatic calculation unless stated otherwise)

✦ Dashboard

✦ Portfolio

✦ Desired Portfolio (Manual Input)

✦ Pies

✦ Allocation

✦ Tickers Info (Manual Input)

✦ Crypto and NFT Portfolios

✦ Transactions/Trades/Dividends History (Manual Input)

✦ Returns

✦ Dividends

✦ Calculators

✦ Valuation

✦ Screener

✦ Annual Reports

✦ Watchlist (Manual Input)

✦ Customization and Info

✦ Guide

&#x200B;

𝐃𝐨𝐰𝐧𝐥𝐨𝐚𝐝 𝐋𝐢𝐧𝐤

\----------------------

[https://www.dropbox.com/t/Nzkbi4zzqzITB7M5](https://www.dropbox.com/t/Nzkbi4zzqzITB7M5)

&#x200B;

Scan Result:

[https://www.virustotal.com/gui/file/e4c553b69d87513d5795272eb76338adb7c4441fecaa67797951df3a766660f3](https://www.virustotal.com/gui/file/e4c553b69d87513d5795272eb76338adb7c4441fecaa67797951df3a766660f3)",0.0,0.922,0.078,0.8738,47,0
2022-05-06 18:28:33,ujtxf5,-0.012839999999999963,Descending channel pattern and weak futures data continue to constrain Ethereum price,0.209,0.791,0.0,-0.4404,"ETH derivatives metrics and technical analysis point toward further downside for Ethereum price.

Despite recovering from a 45-day bottom on April 30, Ether (ETH) remains trapped in a descending channel, and the altcoin's subsequent 9% gain over the last four days was just enough to push it beyond the pattern's $2,870 resistance. This might in turn have an effect of ethereum blockchain projects including play to earn game tokens like MANA and Sandbox and green efficient projects like Nature Vault and Cycled.

The Federal Reserve's monetary policy continues to have a significant impact on cryptocurrency values, and this week's volatility is most likely linked to FOMC statements. The Federal Reserve of the United States boosted its benchmark overnight interest rate by half a percentage point on May 4, the largest increase in 22 years. Despite being widely expected and unanimous, the monetary authority said that it would begin reducing its $9 trillion asset base in June. 

Chairman Jeremy Powell stated that the Federal Reserve is committed to restoring price stability, even if it means reducing company investment and consumer spending. Powell also downplayed the significance of the GDP contraction in the first three months of 2022.

DefiLlama data shows that the network's value locked in smart contracts (TVL) climbed by 7% in 30 days to 25.2 million Ether, despite the fact that Ether's price has corrected by 14% in a month. As a result, it's worth investigating if the price decrease below $3,000 had an impact on futures traders' sentiment.

Traders must examine the Ether futures contracts' premium, commonly known as the basis rate, to determine whether the market has turned bearish. These fixed-calendar futures, unlike perpetual contracts, do not have a funding rate, hence their price will differ significantly from conventional spot markets. 

The expense difference between futures and the ordinary spot market can be used to evaluate market sentiment.

Futures should trade at a 5% to 12% annualized premium in healthy markets to compensate for traders' deposits until the contract settles. Despite this, Ether's yearly premium has remained below this barrier since April 5, as shown above. 

Despite a little increase in the last 24 hours, the present 3.5 percent basis rate is considered bearish since it indicates a lack of demand for leverage purchasers.

Traders should also look into the options markets to rule out futures-specific externalities. The 25 percent delta skew, for example, compares similar call (buy) and put (sell) options. 

When fear is prominent, this metric will turn positive since the premium for protective put options is higher than for similar risk call options. When greed is prominent, the 25 percent delta skew indicator shifts to the negative area, indicating that the market is overvalued.

A neutral area is usually defined as a 25 percent skew indicator range between negative 8% and positive 8%. Since April 16, the statistic has been above such a barrier, and it is now at 14 percent. 

Option traders are paying greater premiums for downside protection, implying that sentiment has deteriorated in the last 30 days. The market is currently seeing an increasing pessimistic attitude. 

Of course, none of this information can foretell if Ether will continue to respect the declining channel, which is now resisting at $2,950. Nonetheless, given the present derivatives data, there is reason to anticipate that any eventual rise above $3,000 will be brief.",0.053,0.834,0.113,0.9848,42,0
2022-05-06 17:48:36,ujt2b8,-0.006259999999999932,Ethereum price prediction comes with a serious warning about its competitors,0.316,0.684,0.0,-0.4019,"The price of Ethereum, the second-largest crypto, has lost 43% since its all-time high of almost $5,000. In January 2022, a panel, that consists of 36 industries, predicted the price of Ethereum to be near $5,800 by the end of 2022.

Now, the panel has returned to a lower price prediction for Ethereum than it did in January, bringing down the target to just 10% above its current price.

This change in prediction was a result of emerging competition from rival blockchains communities like BNB, avalanche, Solana, polkadot, and Cardano.
Keegan Francis, Finder's cryptocurrency editor, said in a statement, “Ethereum, currently, is losing its market share of DeFi to its competitors, although by a huge margin, it remains dominant” and according to Francis, he does not think Ethereum will remain the second-largest cryptocurrency forever.

Different altcoins are introduced to the crypto market almost every day, thereby leading to more competition in the market. Irrespective of the fact that some altcoins do not have any future potential, there are still some that look good.

There are some of the newly launched altcoins that look good and I've been following up on like Apecoin - up 9.0%, COIN - 6.59% with some Ethereum projects Bobcoin - up 10.57%, and Boji - 3.31% also looking good.

Francis also stated that he does not have long-term confidence in Ethereum until Ethereum upgrades its systems and accomplishes its promise to scale.

What do you think will be the fate of Ethereum?",0.038,0.866,0.096,0.9169,5,0
2022-05-06 15:37:30,ujq75g,0.10454000000000005,Why Warren Buffett Doesn't Like Crypto?,0.297,0.703,0.0,-0.2755,"At a Berkshire Hathaway shareholder meeting, Buffett said: that this asset “does not produce anything,” so there is no point in investing in bitcoin: “It's got a magic to it and people have attached magic to lots of things.” 

We can agree with this - the value of BTC is supported mainly by the interest of investors, but just like the currency that exists as long as people believe in it. In this situation, JPMorgan CEO Jamie Dimon rightly said: “Not all of it is bad. If you said to me ‘I want to send $200 to a friend in a foreign country,’ that could take you two weeks and cost you $40. You could do it through a digital currency and it'll take you seconds.”

Perhaps Buffett is comparing bitcoin to a stock? Or maybe he does not like that bitcoin does not provide passive income? After all, real estate brings rent, shares bring dividends, and crypto coins can only be resold. What a huge misconception!

Bitcoin can bring regular payments. Coins can be used for lending, farming, and staking. However, this requires smart contracts, which are available, for example, on the Ethereum platform. In the Bitcoin network itself, indeed, only the simplest functions are available.

Here are the popular options to earn passive income on Bitcoin:

* Lending/Savings Accounts

It is an analog of a bank deposit - you give away assets to make them work and receive part of the income as a fee for using your funds. Lending is the most understandable tool, it can even use “pure” bitcoin. Naturally, you receive income in the same currency. Such operations do not require complex contracts: the coins are simply taken from your account for the duration of the “deposit”, and then returned. It is very important to choose to whom you lend funds. The most reliable options are large exchanges and well-known platforms. For example, the Binance exchange offers 5-6% per annum and [Midas.Investments](https://midas.investments/) platform offers 15%. Be careful with higher rates!

* Staking 

Staking ""freezes"" some of your assets so that they work in the Proof of Stake protocol, where you passively receive new coins for owning the ones you already have. As a result, you earn income from the fees of other users. Staking is a popular tool, but for wBTC the choice is limited. For example, Celsius Network offers up to 4% income.

* Liquidity pools and yield farming 

Yield farming is when your assets are sent to the liquidity pool of a DeFi project. Pools provide operations with cryptocurrencies: they are filled with users' assets, and in return, they accrue income. To fill the pool, you need to deposit. When a platform's client wants to buy wBTC, your assets are taken from the pool. Instead, they add coins that the client paid with. For supporting the operations of the DeFi platform, you are credited with native tokens. They are traded in exchange and can be used for staking.",0.028,0.856,0.116,0.9913,13,0
2022-05-06 12:17:12,ujm5u6,0.5786899999999999,How To Know A Token Is Fundamentally Healthy,0.0,0.69,0.31,0.4019,"Although a token may be safe, how do you know it’s fundamentally healthy?
There are several key features that make a token “fundamentally healthy”, but what does this even mean?


 When a token is fundamentally healthy it means it is not just safe, but that it has the potential to be something successful. While some tokens may be technically safe, this does not mean that they will survive even their first hour of trading. Here are factors that come into play-



Transparency — If you’re in a tokens chat room and the developers are not being transparent about things such as the tokenomics, goals with the token, liquidity lock, etc, it’s one of the clearest red flags to take note of in a new token. The same can be said for the opposite, as transparent developers build trust with their community and investors, creating a more solid foundation for a token to build upon. Know you can trust a developer by watching their transactions live with CoinScan’s Dev Wallet Tracker



Holder Distribution — 99% of tokens have “Whales”, typically early investors that own large percentages of supply. Whales aren’t inherently a bad thing, however if 30% of a tokens supply is owned by 10 wallets while the rest of supply is owned by thousands, often just the 10 wallets will be able to make a token crash. Good holder distribution is not imperative, yet it is a green flag in the world of DeFi as no one person has too much affect on the price, ultimately leveling the playing field.



Good Liquidity — Optimal token liquidity is roughly 15%-20% of its market cap, this way buys and sells don’t have a massive price impact, therefore making the token less volatile while stillTokens with tiny liquidity (less than 10%) are extremely volatile as buys and sells have marginal price impact, essentially “Leverage” in terms of trading. While these tokens may appear to “Pump” harder, they can Dump equally as hard and are dangerous to throw large amounts of money into.



Good Community — More often than not, communities are the primary driving force behind most DeFi tokens! It’s always good to properly analyze and access the strength of a tokens community by joining their telegram, reading their twitter, or even participating in it yourself. If a community is not welcoming to new members, how will it grow?


Track ETH Tokens contract on https://www.coinscan.com/  Trade Defi the right way.",0.052,0.807,0.141,0.9912,10,0
2022-05-06 08:25:17,ujiqz9,-0.21605,Bored Apes creators intentionally jacked up fees on the Ethereum network,0.174,0.826,0.0,-0.2732,"**The skyrocketing of Ethereum fees was triggered more by the non-optimized smart contract than by the high demand for Otherside's virtual land project from Yuga Labs.**

According to[ Coin Metrics](https://coinmetrics.io/), Otherside's smart contract has not been optimized. As mentioned by Twitter user u/WillPapper, the developers got so lazy to remove ready-made templates from the code that they left everything as is, leading to an increase in costs and costing users an extra $70 million.

Even though Yuga Labs implemented buyer verification and limited the first wave of land generation to 2 NFT per address, the demand still exceeded supply. This means that not everyone who wanted land from Otherside could do so.

Such hardships eventually caused market participants to compete, setting higher and higher fees in order to overwhelm each other's deals and become the first in line to generate virtual land. As a result, the average transaction fee was over 2 ETH (\~$5600).

Following the auction, Yuga Labs apologized for disrupting the Ethereum network and offered an alternative. According to them, the ApeCoin ecosystem needs its own blockchain to *“be scaled properly.”*",0.064,0.884,0.052,-0.0827,1,0
2022-05-06 06:57:30,ujhlns,0.55399,Why have Bored Ape NFTs become so popular?,0.179,0.512,0.309,0.3646,"I was always curious why is BAYC gaining so much popularity, they look cool but what's the deal with them?  Not so long ago the Bored Ape NFT was listed for .08 ETH, that was more precisely in April of 2021, and now they’re trading for thousands of dollars each. My question is WHY?   
 

Since the beginning of the NFT craze, I've seen so many fantastic NFT collections, so many beautiful artworks presented as NFTs, so many great communities and NFT projects like SK8coin, and so many great NFT games. I didn't pay as much attention to these popular ones, such as BAYC.    
 

Pls, tell me what you think about it, and what do you think what's the main reason for this collection becoming so popular, like worldwide?   
 

What occurred to me is that because so many celebrities were involved in this collection, we can see so many celebrities with apes as their profile pictures on social media. Another reason is that they might be used as metaverse characters.   
 

But, in any case, they had the perfect timing, and they created such a boom when celebrities began purchasing monkeys.   
 

What do you think will happen to BAYC next? With Ape currencies and their metaverse, they have been developing their ecosystem. The popularity of BAYC is expected to expand in the future years.",0.017,0.745,0.238,0.9959,2,0
2022-05-06 06:40:40,ujhdep,0.49102999999999997,Do you think it's possible that Ethereum gas fees might increase by 500% in the next two years?,0.0,0.881,0.119,0.3182,"What truly upset me was reading in an article that Ethereum gas fees might increase by 500% in the next two years. Do you consider that possible??  


The Ethereum chain is still one of the most powerful in the cryptocurrency business. This was the first chain to use smart contracts, and it remains the largest open-source platform for decentralized apps.  


The Ethereum chain, on the other hand, has struggled with limited scalability, decentralization, and a high gas charge.  


The most obvious example is the recent Bored Ape NFT sale, which increased the Ethereum gas charge to $3,300. Even a $25 transaction on the Ethereum network when Bored Ape NFTs were being offered would cost $3,300 in gas fees.  


I remember when I start using Ethereum I had no clue about all these issues, I was at first very disappointed lol until I start searching for these L2 solutions, now I use Metis which helped me a lot. What do you think is the best solution when it comes to these L2 platforms?  


Ethereum has several major rivals as a result of the fundamental difficulties that some users can no longer tolerate.   


How are you dealing with these issues? Have you considered quitting or have you found a solution?",0.092,0.773,0.135,0.8943,2,0
2022-05-05 18:39:44,uj446r,0.63342,Any news sources that are trustworthy that i should keep an eye on? And any I should stay away from?,0.0,0.811,0.189,0.6072,I'm just getting started with crypto. Is there any news sources that are trustworthy that i should keep an eye on? And any I should stay away from? There is so much info out there and much of it is contradicting. Has there been any news sources that have been consistently good?,0.041,0.834,0.125,0.6946,1,0
2022-05-05 17:24:12,uj2g0w,0.3710900000000001,"Do you have that feeling that people are just interested in crypto and blockchain as an investment, ignoring its numerous use cases?",0.104,0.734,0.162,0.128,"I've seen that as cryptocurrency prices are skyrocketing, most users are just interested in crypto as an investment, ignoring its numerous use cases. There are several obvious benefits for blockchain and cryptocurrencies, as well as how they may truly, drastically transform business processes.  


Have you ever thought more thoroughly of blockchain and its benefits?  


Just remember that so many companies started using blockchain these days. I've seen that Modex blockchain secured land registration, SMS frauds that telecommunication services are dealing with, health care records, and so on and on. Blockchain tech can be really helpful for so many things.  


Since blockchain data is public information and cannot be altered without recording the change, blockchain provides unprecedented security and traceability for transactions.  


Would you say that people will become more aware of all these benefits that blockchain brings and appreciate it more and not see blockchain and crypto only as a piggy bank?  


I found [this link](https://www.connectbit.com/blockchain-applications/) where you can read about all the things blockchain could be used for, I am aware that most people don't know so many things about it but I truly believe that this is the tech of the future.",0.02,0.861,0.12,0.9383,4,0
2022-05-05 15:28:23,uizyu1,0.5437500000000001,What do you think what will 2022 look like for the GameFi sector?,0.0,0.828,0.172,0.3612,"With the rise of NFTs, blockchain gaming has finally gained traction, introducing the play to earn concept which now has so many fans who support these types of games, that's why for a short time we have plenty of these games.                
 

Remember the first games that made a boom on the gaming scene?  Axie Infinity, Splinterlands, and Alien Worlds becoming increasingly popular, and this market sector changed drastically from its early days. What was your first reaction to these types of games and the whole concept of playing to earn?    
 

I was wondering since all these developed so fast, what will the future look like, what are your expectations? Is there something that you would like to change?   
 

Would you say that these games took NFTs to another level? I think that NFTs are most used in the gaming sector, somewhere I read about it, which is quite reasonable since all these games are NFT-powered.   
 

We have NFTs as gaming assets, which may be a gun or armor in a shooting game. I'm a fan of racing games, such as K4 rally, and NFTs might be, I don't know, a part of a vehicle or a car or something to modify your avatar in the game, weapon, magic, or whatever.   
 

This year, I expect that there will be an increase in the number of users, that people will begin to adopt this game concept more openly, and that there will be even more options for users to earn coins while enjoying a unique blockchain-powered gaming experience.",0.018,0.865,0.118,0.9697,7,0
