Date,ID,WeightedAVG,Title,TitleNegative,TitleNeutral,TitlePositive,TitleCompound,Text,TextNegative,TextNeutral,TextPositive,TextCompound,Upvotes,Downvotes
2022-05-02 09:52:10,ugm2cr,0.33183,I was wondering if you could play these NFT-powered games if you have no knowledge of cryptocurrencies or investment,0.107,0.777,0.117,0.0516,"Would you say that these NFT-powered games or GameFi is made up of a young audience of gamers aged 19 to 30 years old? I've heard this in some interviews this statement and I couldn't agree with that cause in these games we have the popular GameFi tokens, which are exchanged for billions of dollars every day, are of interest not just to young people, but also to expert cryptocurrency traders.  


Ofc that I was so happy discovering all these types of games, from racing games like K4 Rally to card games such as Splinterlands first of all because of the gameplay, but truth to be told the idea of ​​making money playing games is understandably popular for game developers and players alike.  


Do you believe that these kinds of games may be a useful investment tool for everyone?  


Because we have multiple groups of individuals playing it, for starters, young gamers frequently earn and spend money while playing, assuring token circulation and demand. When it comes to market specialists, earn money by speculating on exchange rates, whereas investors invest in debt.  


I was wondering what if you don't have any experience with cryptocurrency or investing, can you be able to play these games? Maybe people without any experience can find it difficult to play these games, what do you think?",0.039,0.795,0.166,0.9857,12,0
2022-05-02 09:07:48,uglhgy,0.60865,"I recall how we didn't have as many tools and platforms to help us with some of the challenges we were dealing with, now is a whole different story",0.0,0.862,0.138,0.4588,"What prompted you to begin investing in cryptocurrencies, and when did you begin? I'm curious because, as we went to cryptocurrency adoption, everything started popping up out of nowhere: crypto, metaverse, NFT, and in started to pop out in our everyday conversations, on the TV, media, etc.  


Did someone have an impact on your decision to start working with cryptocurrencies?   


Do you remember when ETH was not worth much a few years ago? I must admit that I didn't expect anything exceptional to happen, and I was surprised how all happened suddenly. I'm glad that day a few years ago I began researching cryptocurrencies more thoroughly.  


I remember how we didn't have so many tools and platforms that will help us with some issues we were dealing with, today is totally different story.  


I'm looking these days for a platform that will enable me to reduce prices, and fees, speed up transactions, and, of course, ensure that everything is in place.   


I've heard a few suggestions and seen on Reddit that some people suggest using a platform called Metis for this purpose. Do you have any prior experience with It?  


Most of us here work with cryptocurrencies and devote significant attention to them. I'd want to find a high-quality platform that would improve and simplify a variety of tasks. Do you have any recommendations?",0.007,0.888,0.105,0.9583,9,0
2022-05-01 20:58:49,ug991t,0.26413000000000003,I think I messed up. Sent staked tokens directly to Kucoin without going through TrustWallet. Any help would be appreciated:),0.114,0.758,0.128,0.0772,I sent my Stakewise sETH2 from its site to Kucoin without sending them to TrustWallet first. Been over a day and transactions are successful on etherscan. Should I move on from this or any chance I can retrieve funds?,0.0,0.851,0.149,0.7003,2,0
2022-05-01 19:40:42,ug7m09,0.48617,"Ethereum fees increased by 86% in the first quarter of 2022, with $2.1 billion in ETH burned.",0.0,0.884,0.116,0.2732,"According to on-chain measurements, the world's largest smart contract network, Ethereum (ETH), (the fuel to so many blockchain projects like Nature Vault that accelerates greener investment with blockchain technology, Cycled which is another greener society based blockchain project and Hydrominer which is about the eco friendly nature of hydro electricity); is experiencing an unprecedented surge in activity. Experts on the Bankless podcast revealed some impressive statistics. 

Bankless, one of the most analytical podcasts on blockchain, crypto, and Web3, provided some statistics from its State of Ethereum Q1 2022 report. Almost every metric went up by orders of magnitude.

To begin, aggregated network hashrate and staked Ethereum (ETH) amount both increased 111 percent as compared to Q1 2021. Fees raised by Ethereum (ETH) network participants were $2.48 billion, up from $1.7 billion a year ago.

Because of the deployment of EIP-1559, the Ethereum (ETH) network destroyed $2.17 billion in equivalent, resulting in a 54 percent decline in the inflation rate. 

The most impressive data, however, comes from the non-fungible tokens (NFTs) group. Net trade volume increased by more than 19,200 percent, from $0.6 billion to $116 billion. The floor price of CryptoPunks has more than sixfold increased.

A number of records were also printed as a result of trading on decentralized exchanges. The net volume of perpetual contracts on Ethereum-based DEXes increased by more than 2,700%, while spot trading volume increased by 667%. 

The total amount of assets locked (TVL) across Ethereum-based Layer 2 solutions, such as Arbitrum and Optimism, has climbed by 964 percent. 

Top segment heavyweights finished the first quarter of 2022 with seven-digit revenue: Arbitrum made $9.4 million, while Optimism earned $5.7 million.",0.011,0.857,0.132,0.9831,105,0
2022-05-01 19:39:17,ug7kxb,0.6837599999999999,Regulation Focused References Links to Cryptocurrency Topics in the United States,0.0,0.625,0.375,0.6597," 

This link directs you to **Central Bank Digital Currency Study Act of 2021**

[https://www.congress.gov/bill/117th-congress/house-bill/2211/text?g=%7B](https://www.congress.gov/bill/117th-congress/house-bill/2211/text?g=%7B)

This link directs you to the ‘Keep your Coins’ bill

[https://www.congress.gov/bill/117th-congress/house-bill/6727/text?q=%7B%22search%22%3A%5B%22H.R.+6727%22%2C%22H.R.%22%2C%226727%22%5D%7D&r=2&s=1](https://www.congress.gov/bill/117th-congress/house-bill/6727/text?q=%7B%22search%22%3A%5B%22H.R.+6727%22%2C%22H.R.%22%2C%226727%22%5D%7D&r=2&s=1)

This link directs you to the court notes from the Ripple v SEC case

[https://www.courtlistener.com/docket/19857399/securities-and-exchange-commission-v-ripple-labs-inc/?filed\_after=&filed\_before=&entry\_gte=&entry\_lte=&order\_by=desc](https://www.courtlistener.com/docket/19857399/securities-and-exchange-commission-v-ripple-labs-inc/?filed_after=&filed_before=&entry_gte=&entry_lte=&order_by=desc)

These next links are to some of the Cryptocurrency Lobby Groups and associations

Lobby3 

[https://www.lobby3.io/](https://www.lobby3.io/)

Coin Center

[https://www.coincenter.org/](https://www.coincenter.org/)

Blockchain Association

[https://theblockchainassociation.org/news/](https://theblockchainassociation.org/news/)

Crypto Council for Innovation

[https://www.cryptoforinnovation.org/](https://www.cryptoforinnovation.org/)

The Bitcoin Pac

[https://www.thebitcoinpac.org/](https://www.thebitcoinpac.org/)

Global DCA

[https://global-dca.org/news/](https://global-dca.org/news/)

Protect Our Future 

[https://www.protectourfuture.us/](https://www.protectourfuture.us/)",0.0,0.91,0.09,0.7399,1,0
2022-05-01 19:38:20,ug7k76,0.50909,"Analysts are optimistic about Ethereum, which has 12 million ETH staked on the consensus layer.",0.0,0.859,0.141,0.3182,"12 million ETH tokens have now been staked on the consensus layer, marking a significant achievement for the altcoin. 

Proponents feel that a big amount of Ethereum staked is a bullish indicator that might fuel an altcoin boom. 

As the altcoin gained popularity among users, Ethereum's revenue surged 46 percent in Q1 2022.

Ethereum price volatility has increased uncertainty among investors. However, analysts are bullish on Ethereum and predict a rally in the altcoin. 

The Ethereum consensus layer has now been staked with 12 million ETH tokens. A boost in Ethereum's staked supply reduces its circulating supply. A decrease in circulating supply is positive for the altcoin's price. 

After experiencing price fluctuation, Ethereum, one of the most valuable crypto and the fuel to so many blockchain projects which include Crayon Dao whose subsidiaries, Heritage Dao and High Sloth Society give investors opportunities to buy ancient artefacts, Ancient Artefacts NFT and Bequest NFT; is on course to recoup its losses. According to Glassnode data, the exchange netflow volume is 6,244 ETH. This indicates that investors have a bullish leaning.

Proponents say investors are positive about Ethereum as a result of the long-awaited merger. The consensus layer deposit contract recently topped 12 million ETH tokens in circulation, accounting for more over 10% of the total ETH supply in circulation. 

$34 billion in ETH has been extracted from Ethereum's circulating supply, with over 376,000 validators contributing to the same in transactions worth 32 ETH or more. Analysts predict the price of Ethereum will above the 55-day simple moving average (SMA), a critical level for confirming a bullish bias. 

Analysts have highlighted $3,018.55 as a significant resistance level for bulls attempting to recover. Analysts have set a downside target of $2,695.79 if the price of Ethereum falls below $2,800.",0.035,0.87,0.095,0.9545,4,0
2022-05-01 19:00:20,ug6rth,0.33087000000000005,Smart money is accumulating Ethereum even as traders warn of a drop to $2.4K,0.216,0.617,0.167,0.0516,"Short-term analysis sets a $2,400 price target for ETH, but data shows smart money continues to accumulate in anticipation of the Merge.

The upcoming Ethereum merge is one of the most widely discussed topics in the crypto sector, one including Bitcoin, Ripple, Doge, Champs e.t.c and analysts have a wide range of perspectives on how the transition to proof of stake could impact Ether's price. 

A deeper dive into the ongoing accumulation of Ether by whale wallets was provided by cryptocurrency intelligence firm Jarvis Labs, which posted the following chart looking at the percentage change in whale wallet holdings versus ET price. 

The color of the dots corresponds to the price of Ether, and the chart shows that whale wallets began to reduce their holdings when the price was above $4,000, and they did not begin to reaccumulate until the price dropped below $2,300.

According to Jarvis Labs, 

""Whales are still accumulating Ether, and their accumulation is still on a sideways-to-uptrend."" 
And it's not only whales eager to scoop up Ether on the cheap, as illustrated in the graphic below, where red dots indicate a rise in accumulation in both whale wallets and lesser wallets.

Jarvis Labs analysts stated, 

""Based solely on the distributions of Ether wallets, it can be deduced that Whales UP + Fishes UP"" (Both whales and Fishes seem to be accumulating). ""How about combining narratives?"" 
Is a decoupling of Ethereum on the horizon? 

Delphi Digital analysts wondered if the price of Ethereum could decouple from BTC before or after the merger. According to the analysts, the altcoin is ""expected to witness additional consolidation for ETH/BTC in the short future.""

One of the key concerns raised by this chart is what it will take for Ether to break free from ""the invisible link"" that has held it tethered to Bitcoin for so long. 

According to Delphi Digital, the current optimistic ""ultrasound money"" and ""Merge"" narratives around Ether could be just what Ether needs to break free from its price correlation to Bitcoin. 

According to Delphi Digital, 

""Interest in ""post-Merge"" Ether will only grow from here, especially as more individuals recognize the possibility to earn higher real rates in a deflationary asset.""",0.007,0.911,0.082,0.9825,49,0
2022-05-01 14:45:16,ug1duw,-0.6902999999999999,"ETH vs Solana ""ETH Killer"" 4/30/22",0.462,0.538,0.0,-0.6486,"Solana gets bot spammed for NFT minting and gets shut down again and has to be restarted again. 

ETH gas goes up temporarily for NFT minting and chugs along and returns to normal shortly after.

But hey Solana is the ""ETH Killer"" and is cheap and fast.",0.115,0.885,0.0,-0.7876,30,0
2022-05-01 08:50:33,ufvrgq,0.05456000000000001,Oobit Pay payment app - the team takes a look at how it came to be and why they do crypto,0.072,0.928,0.0,-0.1027,"The following blog and video introduces Oobit Pay, a mobile payment system that provides a seamless, instant and free means of transferring money. Oobit Pay allows to send crypto payments faster while needing only the recipient’s mobile number: [Oobit: Why We Do Crypto](https://www.oobit.com/blog/oobit_why_we_do_crypto/)",0.063,0.833,0.104,0.4215,0,0
2022-05-01 07:55:02,ufuzo5,0.44366,Need help asap,0.0,0.426,0.574,0.4019,"I wanted to transfer ETH to my friend, so i did it typed all the stuff in the binance app. After that I have waited for few hours and asked my friend, but he didn‘t get it. so I looked up for transaction hash on blockchainexplorer and it says Oops! We couldn’t find what you are looking for.",0.0,0.92,0.08,0.5411,2,0
2022-05-01 05:52:51,uft8w7,0.2874300000000001,"Standard Chartered predicts that Ethereum will reach $35,000 by the end of the year.",0.0,0.922,0.078,0.0258,"According to Business Insider, Geoffrey Kendrick, head of crypto research at British banking behemoth Standard Chartered, the price of Ethereum is still capable of hitting a sky-high aim of $35,000 in the long term. 

Last September, the leading British investment bank declared the overly optimistic aim for the first time. The bitcoin market was gearing up to begin another huge climb following a minor dip at the time. 

Kendrick predicted Bitcoin, Ethereum, Crayon and so many other cryptos and said that Bitcoin would reach a top of roughly $100,000 in early 2022 in September. While Bitcoin did reach a new all-time high of $69,000 in November, it subsequently began a bearish cycle prompted by macroeconomic variables. At the time of writing, the largest cryptocurrency is trading just below the $39,000 mark, underperforming together with US Stocks.

Despite the selloff, institutional money is still flowing into crypto, according to Standard Chartered's chief crypto researcher. 

According to Kendrick, the forthcoming switch to proof-of-stake will undoubtedly enhance the price of Ether. According to U.Today, the much-anticipated network upgrade of Ethereum is set to take place later this year, following a series of delays. 

The analyst also singled out Avalanche and Polkadot as the biggest Ethereum rivals, passing over Solana. 

In July, one of Standard Chartered's businesses revealed plans to launch a cryptocurrency brokerage to capitalize on surging institutional demand for cryptocurrencies.

In October, Standard Chartered CEO Bill Winters said that crypto was here to stay. He said that it was ""perfectly reasonable"" for people to invest in non-fiat cryptocurrencies due to central banks experimenting with their monetary policy.",0.006,0.937,0.058,0.8979,46,0
2022-05-01 03:27:09,ufqzzh,-0.23980999999999997,Is DCA bad advice?,0.538,0.462,0.0,-0.5423,"Is DCA a bad idea?

Interested in folks thoughts….

If we accept we can’t time the market and on balance it is better to just be in the market for the long term then is DCA bad advice? 

Does it make even less sense when inflation is just eating away at your dollars that you have sidelined to DCA?

Seems to me you just decide how much you want to invest and then choose a point where you say you are all in. On average, you are likely to buy higher with DCA as the long-term trend is up…. 

Is DCA simply a way to cater for loss aversion. We are happy to buy higher  than we are to see price go down after we bought.

Just a poorly formed thought and am keen to hear why I am incorrect.",0.08,0.815,0.106,0.466,6,0
2022-04-30 20:45:42,ufjo9w,0.75945,"I am amazed how blockchain technology has the ability to modify many aspects of business, government, and even our personal life",0.0,0.766,0.234,0.6705,"Not only banking and healthcare, but blockchain technology has the ability to modify many aspects of business, government, and even our personal life.

Selecting the right blockchain is important here, I've seen that many businesses are now depending on Modex Blockchain Database. According to what I've heard, they've been in business since 2017, which makes them trustworthy, and individuals have had positive experiences with them.

Blockchains are not all the same. If the consensus mechanism is not entirely decentralized, or if full nodes have the power to reverse or censor transactions, the same concerns as in traditional systems will arise.

In my opinion, standards must also be defined because there are now numerous distinct blockchain protocols competing with one another.

Do you have any firsthand experience with these systems that can help protect our data using blockchain that you can share with us?",0.024,0.825,0.151,0.967,19,0
2022-04-30 20:14:05,ufj2ly,0.79843,Who knows how many of these new coins and cryptocurrencies that appear on a daily basis will gain popularity,0.0,0.711,0.289,0.7579,"Did you know that according to Deutsche Bank, digital currencies will have over 200 million users by 2030? What are your thoughts about that?  


I don't think it's a surprise, given that there are more and more crypto holders every day, and, believe it or not, additional cryptocurrencies are being released every month.  


According to Deutsche Bank, the number of cryptocurrency users will more than double in the next ten years, reaching 200 million. This rate of growth is nearly identical to that of the Internet in its first 20 years.  


I had no clue hundreds of new cryptocurrencies, whether altcoins or tokens, were produced every month!   


I just googled new cryptocurrencies this month, and there are a lot of them.  I was shocked to learn about Unicoin this month since I had heard that they should be invested in hundreds of emerging growth firms with significant development potential, and that is how the holders' profit.  


Who knows how many of these new coins and cryptocurrencies that appear on a daily basis will gain popularity. Isn't it true that time will tell?",0.045,0.848,0.106,0.893,20,0
2022-04-30 18:52:09,ufhgon,0.4047200000000001,3 letter ens? An exercise in trust. I found 1 -is taken but contract expires tomorrow afternoon (5/1/22),0.0,0.867,0.133,0.2846,"I was browsing ens for some of those elusive 3 letter .Eth addresses. There are still some available, but most are random assortments of characters. I did, however, find one of the last English language words (3letter) addresses. As I said it is taken, but the contract expires tomorrow. 

If I had 1000$ laying around, I would mint it myself. That is not the case. 

I could ask for the money to buy it, with a promise to repay. But that’s too time consuming. 

So, if you want to grab that, dm me. I’ll tell you when and where. If you do mint it,I want a smoll finders feee",0.0,0.936,0.064,0.685,1,0
2022-04-30 15:59:49,ufe0nn,0.79893,[Poll Proposal] Switch Liquidity incentive bonuses for Honeyswap and Uniswap,0.0,0.567,0.433,0.7269,"As all new donuts will be distributed via the Gnosis(xdai) more and more liquidity will be getting added to the honeyswap pool thinning out the overall bonus for those providing liquidity on the chain that is already lower than the Uniswap bonus. Currently Uniswap LP providers who stake their donuts get 400k while honey swap LP providers only get 200k. I would like to see these numbers swapped so honey swap providers get 400k and uniswap providers get 200k. This would further incentivize people to use their newly acquired donuts to provide LP as all tokens are now distributed on gnosis and learn more about how defi works in the process.

Poll:

Should we swap the monthly Liquidity providing bonuses for Uniswap(400k) and Honeyswap(200k) donut LP providing

1.\[Yes\] Swap the Uniswap and Honeyswap LP providing bonus incentives

2. \[No\] Remain as is for LP bonus incentives

3. \[Abstain\] You are indifferent

“This proposal will be stickied for a minimum of 2 days and requires at least 2 mods to sign-off on the formatting before proceeding to a snapshot vote per the governance rules and guidelines [https://www.reddit.com/r/ethtrader/wiki/governance](https://www.reddit.com/r/ethtrader/wiki/governance)

Edit: adding polling options and information about the poll proposal process

Edit 2: typo

Edit 3: Adding link to governance rules

Edit 4: 3rd option

Edit 5: formatting",0.018,0.874,0.108,0.967,11,0
2022-04-30 12:58:28,ufakmp,0.6441600000000001,I've seen that a growing number of businesses are already accepting ETH payments,0.0,0.616,0.384,0.5574,"I began to consider what we might buy with ETH because there are so many projects and businesses that now accept this type of payment.  


Ethereum was established with the intention of stressing smart contracts and decentralized, self-executing agreements incorporated in the network itself.  


Every one of these potential advantages is accessible with ETH, and I've seen that a growing number of businesses are already accepting ETH payments.  


When it comes to NFTs, we may buy them with ETH and use them to pay for other services provided by other projects and markets, such as SK8coin or any other that accepts ETH.  


Must mention that I did not use ETH to directly pay for anything. When we take a closer look, we can see that we are already using ETH to pay for a range of things, even when we exclude the tokens we purchase for future payments.  


Would you use it to purchase NFTs or to pay for products or services? Do you believe that Ethereum will be utilized on a daily basis in the near future?",0.054,0.849,0.098,0.8466,17,0
2022-04-30 12:22:54,ufa05d,0.49001000000000006,Would you say that the art NFT economy will be huge?,0.0,0.813,0.187,0.3182,"It's terrible that, with the advent of the internet, where anything can be copied and pasted without the creator's permission, we as people have allowed artwork to languish for so long.  


On the other hand, NFTs help artists overcome this critical issue by ensuring ownership of each digital production - an NFT owner owns just the token itself, not the underlying item or any related copyright.  


Whether you believe the hype or not, NFTs are going to change the art industry, affecting not just how art is acquired and sold, but also what kind of art we value and whose artists we support.  


NFT markets are the answer to making NFT artworks. Users may mint NFT by uploading their digital artwork to the marketplace site.  


Would you believe that NFTs will alter the current art market trading mechanism, particularly for digital art?  


Yet, of course, there are many different kinds of marketplaces. Because I've been skating my entire life, I'd absolutely put my NFT on a Sk8coin if it had anything to do with skateboarding. They assist skaters, sports teams, artists, and others. As you can see, there are a variety of options for minting and submitting your NFT artwork.  


Would you say that the art NFT economy will be huge?",0.018,0.912,0.07,0.8909,17,0
2022-04-30 12:06:00,uf9qlj,-0.11709000000000004,"While it may be difficult to avoid using the internet, how can you protect your privacy and safety?",0.195,0.581,0.224,0.1779,"The Internet evolved so quickly that we now have access to everything conceivable, and there are no limitations. Can we, however, always rely on the administrator or other users of the Internet network service provider that we use?  


There have been several malversations and thefts, particularly since the popularity of cryptocurrencies began to rise, and we must secure our data and exercise extreme caution.  


Of course, with the advent of the IT and crypto sectors, we now have solutions to our concerns. I'm now using Zenotta and I can say that I feel safer, but it's frightening how many average customers get their info hijacked, it's terrible.  


The threat to Internet security is a key hurdle to electronic transactions through the Internet medium.  


Many CEOs are puzzled by the current popularity and possible profitability of internet commerce. Connecting to the Internet and expanding their business would, in other words, expose them to dangers and threats of invasion. On the other hand, being disconnected from the Internet would mean losing communication with consumers and services to competitors.  


Therefore, while it's tough to stop surfing the internet, how can you ensure your privacy and safety? What is your long-term plan?",0.147,0.731,0.121,-0.8054,17,0
