Date,ID,WeightedAVG,Title,TitleNegative,TitleNeutral,TitlePositive,TitleCompound,Text,TextNegative,TextNeutral,TextPositive,TextCompound,Upvotes,Downvotes
2022-04-30 10:20:37,uf8agm,-0.4639,Dealing with high gas prices and delayed transactions may be critical for all of these newcomers who are getting to know Ethereum,0.174,0.826,0.0,-0.4939,"The Ethereum chain has battled with limited scalability, decentralization, and a high gas fee. This was the first chain to incorporate smart contracts, and it is still the largest open-source platform for decentralized apps.   


ETH is used for every possible transaction, whether we're directly paying with ETH or purchasing some of these tokens that give us additional payment for marketplaces.  


So, dealing with high gas prices and delayed transactions is crucial from the start. Do you recall when the Ethereum gas fee once hit $50?  


I remember when I first started using ETH, I had no clue about any of these issues, and I was pretty frustrated at first until I started looking for these L2 solutions or applications that analyze the pending transactions on the mainnet Ethererum, and now I use Metis, which helped me a lot.  


Although, things are starting to improve, and as you are all aware, ETH now has a variety of big rivals as a result of fundamental ETH flaws that some consumers can no longer handle. How are you dealing with these gas issues?",0.077,0.866,0.057,-0.3939,17,0
